{
    "$schema": "http://json-schema.org/draft-07/schema#",

    "definitions": {
        "dateType": {
            "$comment": "Type for the date format YYYY-MM-DD. (Python package jsonschema missing support for JSON Schema date format.)",
            "type": "string", 
            "pattern": "^\\d{4}\\-(0?[1-9]|1[012])\\-(0?[1-9]|[12][0-9]|3[01])$"
        },

        "multilingualStringType": {
            "$comment": "Type for language support.",
            "type": "array",
            "items": {
                "type": "object",
                "properties": {
                    "languageCode": {"type": "string",
                        "enum": ["no", "nb", "nn", "en"]},
                    "value": {"type": "string"}
                },
                "required": [
                    "languageCode",
                    "value"
                ]
            }
        },

        "codeListType": {
            "type": "object",
            "properties": {
                "name": {"type": "string"},
                "topLevelCodeItems": {
                    "type": "array",
                    "items": {
                        "type": "object",
                        "properties": {
                            "code": {"type": "string"},
                            "categoryTitle": {"$ref": "#/definitions/multilingualStringType"},
                            "validityPeriodStart": {"$ref": "#/definitions/dateType"},
                            "validityPeriodStop": {"$ref": "#/definitions/dateType"}
                        },
                        "required": [
                            "code",
                            "categoryTitle",
                            "validityPeriodStart"
                        ]
                    }
                }
            },
            "required": [
                "name",
                "topLevelCodeItems"
            ]
        },

        "valueDomainType": {
            "type": "object",
            "properties": {
                "name": {"type": "string"},
                "title": {"$ref": "#/definitions/multilingualStringType"},
                "description": {"$ref": "#/definitions/multilingualStringType"},
                "uriDefinition": {
                    "type": "array",
                    "items": [
                        {"type": [ "string", "null" ]}
                    ]
                },
                "codeList": {"$ref": "#/definitions/codeListType"},
                "measurementUnitDescription": {"$ref": "#/definitions/multilingualStringType"}
            },
            "required": [
                "name",
                "title"
            ]
        },

        "unitTypeType": {
            "type": "object",
            "properties": {
                "name": {"type": "string"},
                "title": {"$ref": "#/definitions/multilingualStringType"},
                "description": {"$ref": "#/definitions/multilingualStringType"}
            },
            "required": [
                "name",
                "title",
                "description"
            ]
        },

        "subjectFieldType": {
            "type": "array",
            "items": [
                {
                    "type": "object",
                    "properties": {
                        "name": {"type": "string"},
                        "title": {"$ref": "#/definitions/multilingualStringType"},
                        "description": {"$ref": "#/definitions/multilingualStringType"}
                    },
                    "required": [
                        "name",
                        "title",
                        "description"
                    ]
                }
            ]
        }
    },

    
    "type": "object",
    "properties": {
        "name": {"type": "string"},
        "title": {"$ref": "#/definitions/multilingualStringType"},
        "description": {"$ref": "#/definitions/multilingualStringType"},
        "populationDescription": {"$ref": "#/definitions/multilingualStringType"},
        "temporalityType": {"type": "string",
            "enum": ["FIXED", "STATUS", "ACCUMULATED", "EVENT"]
        },
        "spatialCoverageDescription": {"$ref": "#/definitions/multilingualStringType"},
        "dataRevision": {
            "type": "object",
            "properties": {
                "version": {"type": "string",
                    "pattern": "^([0-9]+)\\.([0-9]+)\\.([0-9]+)$"
                },
                "releaseStatus": {"type": "string",
                    "enum": ["DRAFT", "PENDING_RELEASE", "RELEASED", "PENDING_DELETE", "DELETED"]
                },
                "operationType": {"type": "string",
                    "enum": ["ADD", "REMOVE", "CHANGE_DATA", "CHANGE_METADATA", "PATCH"]
                },
                "description": {"$ref": "#/definitions/multilingualStringType"},
                "temporalCoverageStart": {"$ref": "#/definitions/dateType"},
                "temporalEndOfSeries": {"type": "boolean"},
                "releaseDate": {"$ref": "#/definitions/dateType"},
                "temporalCoverageLatest": {"$ref": "#/definitions/dateType"},
                "temporalStatusDates": {
                    "type": "array",
                    "items": {"$ref": "#/definitions/dateType"}
                }
            },
            "required": [
                "version",
                "releaseStatus",
                "operationType",
                "description",
                "temporalCoverageStart",
                "temporalEndOfSeries",
                "releaseDate",
                "temporalCoverageLatest"
            ]
        },
        "measure": {
            "type": "object",
            "properties": {
                "name": {"type": "string"},
                "title": {"$ref": "#/definitions/multilingualStringType"},
                "description": {"$ref": "#/definitions/multilingualStringType"},
                "uriDefinition": {
                    "type": "array",
                    "items": {"type": ["string", "null"] }
                },
                "dataType": {"type": "string",
                    "enum": ["STRING", "LONG", "DOUBLE", "DATE"]
                },
                "subjectField": {"$ref": "#/definitions/subjectFieldType"},
                "valueDomain": {"$ref": "#/definitions/valueDomainType"},
                "format": {"type": "string",
                    "enum": ["RandomUInt48"]
                },
                "unitType": {"$ref": "#/definitions/unitTypeType"},
                "sentinelAndMissingValueDomain": {"$ref": "#/definitions/valueDomainType"}
            },
            "required": [
                "name",
                "uriDefinition",
                "dataType",
                "subjectField",
                "valueDomain"
            ]
        },
        "ssbProperty": {
            "type": "array",
            "items": {
                "type": "object",
                "properties": {
                    "key": {"type": "string"},
                    "value": {"type": "string"}
                },
                "required": [
                    "key",
                    "value"
                ]
            }
        },
        "identifier": {
            "type": "array",
            "items": {
                "type": "object",
                "properties": {
                    "name": {"type": "string"},
                    "title": {"$ref": "#/definitions/multilingualStringType"},
                    "description": {"$ref": "#/definitions/multilingualStringType"},
                    "format": {"type": "string",
                        "enum": ["RandomUInt48"]
                    },
                    "unitType": {"$ref": "#/definitions/unitTypeType"},
                    "valueDomain": {"$ref": "#/definitions/valueDomainType"}
                },
                "required": [
                    "name",
                    "title",
                    "description",
                    "format",
                    "unitType",
                    "valueDomain"
                ]
            }
        },
        "attribute": {
            "type": "array",
            "items": {
                "type": "object",
                "properties": {
                    "name": {"type": "string"},
                    "title": {"$ref": "#/definitions/multilingualStringType"},
                    "description": {"$ref": "#/definitions/multilingualStringType"},
                    "dataType": {"type": "string",
                        "enum": ["STRING", "LONG", "DOUBLE", "DATE"]
                    },
                    "attributeType": {"type": "string",
                        "enum": ["START", "STOP", "QUALITY", "SOURCE", "OTHER"]},
                    "valueDomain": {"$ref": "#/definitions/valueDomainType"},
                    "format": {"type": "string"}
                },
                "required": [
                    "name",
                    "title",
                    "description",
                    "dataType",
                    "attributeType",
                    "valueDomain"
                ]
            }
        }
    },
    "required": [
        "name",
        "title",
        "description",
        "populationDescription",
        "temporalityType",
        "spatialCoverageDescription",
        "dataRevision",
        "measure",
        "identifier",
        "attribute"
    ]
}