{
    "name": "TEST_PERSON_INCOME",
    "title": [
        {"languageCode": "no", "value": "Inntekt"},
        {"languageCode": "en", "value": "Income"}
    ],
    "description": [
        {"languageCode": "no", "value": "Personinntekt."},
        {"languageCode": "en", "value": "Personal income."}
    ],
    "populationDescription": [
        {"languageCode": "no", "value": "Alle personer med inntekt."},
        {"languageCode": "en", "value": "All persons with income."}
    ],
    "temporalityType": "ACCUMULATED",
    "spatialCoverageDescription": [
        {"languageCode": "no", "value": "Norge"},
        {"languageCode": "en", "value": "Norway"}
    ],    
    "dataRevision": {
        "version": "1.0.0",
        "releaseStatus": "RELEASED",
        "operationType": "ADD",
        "releaseDate": "2020-03-25",
        "description": [
            {"languageCode": "no", "value": "Første versjon av datasettet."},
            {"languageCode": "en", "value": "The initial version of this dataset."}
        ],  
        "temporalCoverageStart": "2016-01-01",
        "temporalEndOfSeries": false,
        "temporalCoverageLatest": "2019-12-31"
    },
    "measure": {
        "name": "TEST_PERSON_INCOME",
        "uriDefinition": ["https://data.skatteetaten.no/begrep/personinntekt%20fra%20l%C3%B8nnsinntekt"],
        "dataType": "LONG",
        "subjectField": [
            {
                "name": "INCOME_PROPERTY_TAX",
                "title": [
                    {"languageCode": "no", "value": "Inntekt"},
                    {"languageCode": "en", "value": "Income"}
                ],
                "description": [
                    {"languageCode": "no", "value": "Innekt, formue, skatt"},
                    {"languageCode": "en", "value": "Income, property, taxes"}
                ]
            }
        ],
        "valueDomain": {
            "name": "INCOME",
            "title": [
                {"languageCode": "no", "value": "Personinntekt i norske kroner (NOK)."},
                {"languageCode": "en", "value": "Personal income in Norwegian kroner (NOK)."}
            ],
            "uriDefinition": [null]
        }
    },
    "identifier": [
        {
            "name": "PERSON_ID_1",
            "title": [
                {"languageCode": "no", "value": "Personidentifikator"},
                {"languageCode": "en", "value": "National identity number"}
            ],
            "description": [
                {"languageCode": "no", "value": "Identifikator for person"},
                {"languageCode": "en", "value": "Persons national identity number"}
            ],
            "format": "RandomUInt48",
            "unitType": {
                "name": "PERSON",
                "title": [
                    {"languageCode": "no", "value": "Person"},
                    {"languageCode": "en", "value": "Person"}
                ],
                "description": [
                    {"languageCode": "no", "value": "Statistisk enhet er person (individ, enkeltmenneske)."},
                    {"languageCode": "en", "value": "Statistical unit is person"}
                ]
            },
            "valueDomain": {
                "name": "FOEDSELSNUMMER",
                "title": [
                    {"languageCode": "no", "value": "Pseudonymisert fødselsnummer"},
                    {"languageCode": "en", "value": "Pseudonym for persons national identity number"}
                ],
                "uriDefinition": [
                    "http://www.ssb.no/a/metadata/conceptvariable/vardok/26/nb", 
                    "https://www.ssb.no/a/metadata/conceptvariable/vardok/26/en"
                ],
                "measurementUnitDescription": [
                    {"languageCode": "no", "value": "N/A"},
                    {"languageCode": "en", "value": "N/A"}
                ]
            }
        }
    ],
    "attribute": [
        {
            "name": "START",
            "title": [
                {"languageCode": "no", "value": "Startdato"},
                {"languageCode": "en", "value": "Start date"}
            ],
            "description": [
                {"languageCode": "no", "value": "Startdato/måletidspunktet for hendelsen"},
                {"languageCode": "en", "value": "Event start date"}
            ],
            "dataType": "DATE",
            "attributeType": "START",
            "valueDomain": {
                "name": "START_DATE_EVENT",
                "title": [
                    {"languageCode": "no", "value": "Startdato"},
                    {"languageCode": "en", "value": "Start date"}
                ],
                "uriDefinition": [null],
                "measurementUnitDescription": [
                    {"languageCode": "no", "value": "N/A"},
                    {"languageCode": "en", "value": "N/A"}
                ]
            }
        },
        {
            "name": "STOP",
            "title": [
                {"languageCode": "no", "value": "Stoppdato"},
                {"languageCode": "en", "value": "Stop date"}
            ],
            "description": [
                {"languageCode": "no", "value": "Stoppdato/sluttdato for hendelsen"},
                {"languageCode": "en", "value": "Event stop/end date"}
            ],
            "dataType": "DATE",
            "attributeType": "STOP",
            "valueDomain": {
                "name": "STOP_DATE_EVENT",
                "title": [
                    {"languageCode": "no", "value": "Stoppdato/sluttdato"},
                    {"languageCode": "en", "value": "Stop/end date"}
                ],
                "uriDefinition": [null],
                "measurementUnitDescription": [
                    {"languageCode": "no", "value": "N/A"},
                    {"languageCode": "en", "value": "N/A"}
                ]
            }
        }
    ]
}